{
  "version": 1,
  "default_map_id": "visio_lab_floor_demo_v3",
  "robot": {
    "host": "192.168.123.18",
    "ssh_user": "unitree",
    "network_interface": "eth0",
    "slam_gateway_client": "/home/unitree/slam_gateway_refactor/build/slam_llm_command_client",
    "unitree_slam_dir": "/unitree/module/unitree_slam"
  },
  "maps": [
    {
      "map_id": "visio_lab_floor_demo_v3",
      "name": "Visio实验室楼层模拟地图v3",
      "status": "simulation",
      "pcd_path": "/home/unitree/maps/visio_lab_floor_demo_v3.pcd",
      "topology_path": "/home/unitree/maps/visio_lab_floor_demo_v3.topology.json",
      "frame_id": "map",
      "description": "根据绘图1.vsdx和绘图1.png重绘的模拟拓扑。所有过道都可能有人；701和702门可能关闭；赵博办公室门口和701门口走廊需要拍照。坐标为模拟相对坐标。",
      "topology_nodes": [
        {"node_id": "start_point", "name": "起始点", "node_type": "startup", "aliases": ["起点", "启动点", "701起点"], "tags": ["startup", "hallway", "people_possible"], "pose": {"x": 0.0, "y": 0.0, "z": 0.0, "yaw": 0.0, "speed": 0.35, "mode": 0}, "description": "靠近701门口的起始点。"},
        {"node_id": "charging_point", "name": "充电点", "node_type": "charging_station", "aliases": ["充电区", "回充点", "充电桩"], "tags": ["charging", "safe_stop"], "pose": {"x": -1.0, "y": -1.5, "z": 0.0, "yaw": 3.14, "speed": 0.3, "mode": 0}, "description": "701门口左侧附近的充电点。"},
        {"node_id": "room_701_door_photo", "name": "701门口走廊拍照点", "node_type": "doorway_photo_point", "aliases": ["701门口", "701入口", "701门口走廊", "701拍照点"], "tags": ["701", "doorway", "door_may_close", "photo_required", "people_possible"], "pose": {"x": 0.0, "y": -2.0, "z": 0.0, "yaw": -1.57, "speed": 0.3, "mode": 0}, "description": "701门口附近走廊，需要到达后拍照；701门可能关闭。"},
        {"node_id": "zhao_bo_office_front", "name": "赵博办公室门口", "node_type": "office_front_photo_point", "aliases": ["赵博办公室", "赵博门口", "赵博办公室门口"], "tags": ["office", "photo_required", "people_possible"], "pose": {"x": 4.0, "y": 4.0, "z": 0.0, "yaw": 1.57, "speed": 0.3, "mode": 0}, "description": "赵博办公室门口，需要到达后拍照。"},
        {"node_id": "nie_guoli_office_front", "name": "聂国篱办公室门口", "node_type": "office_front", "aliases": ["聂国篱办公室", "聂国篱门口", "国篱办公室"], "tags": ["office", "people_possible"], "pose": {"x": 2.0, "y": 4.0, "z": 0.0, "yaw": 1.57, "speed": 0.3, "mode": 0}, "description": "聂国篱办公室门口。"},
        {"node_id": "corridor_center", "name": "过道中心", "node_type": "hallway_midpoint", "aliases": ["过道中心", "上方过道中心", "4m过道中心"], "tags": ["hallway", "transit", "people_possible"], "pose": {"x": 0.0, "y": 3.5, "z": 0.0, "yaw": 0.0, "speed": 0.35, "mode": 0}, "description": "上方过道中心，过道可能有人。"},
        {"node_id": "yin_siyuan_station", "name": "尹思园工位", "node_type": "workstation", "aliases": ["尹思园", "尹思园位置", "尹思园工位"], "tags": ["workstation", "people_possible"], "pose": {"x": -1.5, "y": 1.8, "z": 0.0, "yaw": 3.14, "speed": 0.3, "mode": 0}, "description": "尹思园工位。"},
        {"node_id": "yang_shuyang_station", "name": "杨书洋工位", "node_type": "workstation", "aliases": ["杨书洋", "杨书洋位置", "杨书洋工位"], "tags": ["workstation", "people_possible"], "pose": {"x": 2.0, "y": 0.8, "z": 0.0, "yaw": 0.0, "speed": 0.3, "mode": 0}, "description": "杨书洋工位。"},
        {"node_id": "yang_xinru_station", "name": "杨鑫茹工位", "node_type": "workstation", "aliases": ["杨鑫茹", "杨鑫茹位置", "杨鑫茹工位"], "tags": ["workstation", "people_possible"], "pose": {"x": 6.5, "y": 1.0, "z": 0.0, "yaw": 0.0, "speed": 0.3, "mode": 0}, "description": "杨鑫茹工位。"},
        {"node_id": "zhao_guosen_station", "name": "赵国森工位", "node_type": "workstation", "aliases": ["赵国森", "赵国森位置", "赵国森工位"], "tags": ["workstation", "left_area", "people_possible"], "pose": {"x": -8.0, "y": 0.5, "z": 0.0, "yaw": 3.14, "speed": 0.3, "mode": 0}, "description": "赵国森工位。"},
        {"node_id": "room_702_door", "name": "702门口", "node_type": "doorway", "aliases": ["702门", "702入口", "702门口"], "tags": ["702", "doorway", "door_may_close", "people_possible"], "pose": {"x": 6.0, "y": -2.0, "z": 0.0, "yaw": -1.57, "speed": 0.3, "mode": 0}, "description": "702门口，门可能关闭。"}
      ],
      "topology_edges": [
        {"from": "start_point", "to": "room_701_door_photo", "bidirectional": true, "expected_distance_m": 2.0, "description": "701门可能关闭；走廊可能有人；到达后拍照"},
        {"from": "start_point", "to": "charging_point", "bidirectional": true, "expected_distance_m": 2.0, "description": "回充路径"},
        {"from": "start_point", "to": "yin_siyuan_station", "bidirectional": true, "expected_distance_m": 4.0, "description": "过道可能有人"},
        {"from": "start_point", "to": "yang_shuyang_station", "bidirectional": true, "expected_distance_m": 3.0, "description": "过道可能有人"},
        {"from": "start_point", "to": "yang_xinru_station", "bidirectional": true, "expected_distance_m": 8.0, "description": "过道可能有人"},
        {"from": "start_point", "to": "corridor_center", "bidirectional": true, "expected_distance_m": 4.0, "description": "上方过道可能有人"},
        {"from": "corridor_center", "to": "zhao_bo_office_front", "bidirectional": true, "expected_distance_m": 4.0, "description": "赵博办公室门口需要拍照"},
        {"from": "corridor_center", "to": "nie_guoli_office_front", "bidirectional": true, "expected_distance_m": 4.0, "description": "办公室门口巡检路径"},
        {"from": "start_point", "to": "room_702_door", "bidirectional": true, "expected_distance_m": 12.0, "description": "702门可能关闭；过道可能有人"},
        {"from": "start_point", "to": "zhao_guosen_station", "bidirectional": true, "expected_distance_m": 16.0, "description": "左侧长走廊可能有人"}
      ]
    }
  ]
}
